source,app,title,description,datamodel,"providing_technologies","security_domain",category,"use_case",mitre,killchain,"detection_searches","investigative_searches","contextual_searches","support_searches",qualifiedSearch
ES,"SA-EndpointProtection","Prohibited Service Detected","Alerts when a service in the prohibited service list is detected.",,,endpoint,,,,,"Prohibited Service Detected",,,,"search NOT sourcetype=stash `service` | `get_interesting_services` | search is_prohibited=true | `get_event_id` | fields + event_id,_raw,dest,service,note"
ES,"SA-ThreatIntelligence","Same Error On Many Servers Detected","Alerts when multiple systems are exhibiting the same errors",,,threat,,,,,"Same Error On Many Servers Detected",,,,"search tag=error NOT tag=authentication | stats first(_raw) as orig_raw,dc(host) as system_count by sourcetype,punct | where 'system_count'>100"
ES,"DA-ESS-AccessProtection","Short-lived Account Detected","Detects when a account or credential is created and then removed a short time later. This may be an indication of malicious activities.",Change,,access,,,,,"Short-lived Account Detected",,,," tstats `summariesonly` count from datamodel=Change.All_Changes where nodename=""All_Changes.Account_Management"" (All_Changes.action=""created"" OR All_Changes.action=""deleted"") by _time,All_Changes.dest,All_Changes.user span=1s | `drop_dm_object_name(""All_Changes"")` | streamstats range(_time) as delta,sum(count) as count by user,dest window=2 global=f | where count>1 AND delta<`useraccount_minimal_lifetime` | `uptime2string(delta,timestr)` | table user, dest, delta, timestr"
ES,"SA-EndpointProtection","Should Timesync Host Not Syncing","Detects when hosts that are required to synchronize their clocks have failed to do so. Time synchronization is important because it ensures that the event logs are stamped with the proper time. Additionally, this is required by some regulatory compliance standards (such as PCI).",Performance,,endpoint,,,,,"Should Timesync Host Not Syncing",,,," tstats `summariesonly` max(_time) as lastTime from datamodel=Performance.All_Performance where nodename=All_Performance.OS.Timesync All_Performance.OS.Timesync.action=success by All_Performance.dest | rename All_Performance.dest as dest | `get_asset(dest)` | rename dest_* as * | `assets` | search should_timesync=true | stats max(lastTime) as lastTime,first(should_timesync) as should_timesync,values(asset) as dest by asset_id | where isnull(lastTime) | addinfo | eval hourDiff=floor((info_max_time-info_min_time)/3600) | fields dest,should_timesync,hourDiff"
ES,"SA-NetworkProtection","Substantial Increase In Intrusion Events","Alerts when a statistically significant increase in a particular intrusion event is observed.","Intrusion_Detection",,network,,,,,"Substantial Increase In Intrusion Events",,,," tstats `summariesonly` count as ids_attacks,values(IDS_Attacks.tag) as tag from datamodel=Intrusion_Detection.IDS_Attacks by IDS_Attacks.signature | `drop_dm_object_name(""IDS_Attacks"")` | `mltk_apply_upper(""app:count_by_signature_1h"", ""high"", ""ids_attacks"")`"
ES,"SA-NetworkProtection","Substantial Increase In Port Activity","Alerts when a statistically significant increase in events on a given port is observed.","Network_Traffic",,network,,,,,"Substantial Increase In Port Activity",,,," tstats `summariesonly` count as dest_port_traffic_count,values(All_Traffic.tag) as tag from datamodel=Network_Traffic.All_Traffic by All_Traffic.dest_port | `drop_dm_object_name(""All_Traffic"")` | `mltk_apply_upper(""app:count_by_dest_port_1d"", ""extreme"", ""dest_port_traffic_count"")`"
ES,"DA-ESS-ThreatIntelligence","Threat Activity Detected","Alerts when any activity matching threat intelligence is detected.","Threat_Intelligence",,threat,,,,,"Threat Activity Detected",,,," from datamodel:""Threat_Intelligence"".""Threat_Activity"" | dedup threat_match_field,threat_match_value | `get_event_id` | table _raw,event_id,source,src,dest,threat*,weight | rename weight as record_weight | `per_panel_filter(""ppf_threat_activity"",""threat_match_field,threat_match_value"")` | `get_threat_attribution(threat_key)` | rename source_* as threat_source_*,description as threat_description | eval risk_score=case(isnum(record_weight), record_weight, isnum(weight), weight, 1=1, null())  | fields - *time | eval risk_object_type=case(threat_match_field=""query"" OR threat_match_field==""src"" OR threat_match_field==""dest"",""system"",threat_match_field==""src_user"" OR threat_match_field==""user"",""user"",1=1,""other"") | eval risk_object=threat_match_value"
ES,"DA-ESS-NetworkProtection","Unroutable Activity Detected","Alerts when activity to or from a host that is unroutable is detected.",Web,,network,,,,,"Unroutable Activity Detected",,,," `tstats` count,values(sourcetype) from datamodel=Network_Traffic.All_Traffic where All_Traffic.action=""allowed"" AND `bogonlist_src_dest_subsearch(All_Traffic)` by All_Traffic.src,All_Traffic.dest | `drop_dm_object_name(""All_Traffic"")` | `tstats` append=true count,values(sourcetype) from datamodel=Intrusion_Detection.IDS_Attacks where `bogonlist_src_dest_subsearch(IDS_Attacks)` by IDS_Attacks.src,IDS_Attacks.dest | `drop_dm_object_name(""IDS_Attacks"")` | `tstats` append=true count,values(sourcetype) from datamodel=Web.Web where `bogonlist_src_dest_subsearch(Web)` by Web.src,Web.dest | `drop_dm_object_name(""Web"")` | stats count,values(sourcetype) as sourcetype by src,dest | `bogonlist_lookup` | eval bogon_ip=if(dest_is_bogon==""true"" AND dest_is_internal!=""true"",dest,src) | fields + sourcetype,src,dest,bogon_ip"
ES,"SA-ThreatIntelligence","Untriaged Notable Events","Alerts when notable events have not been triaged",,,,,,,,"Untriaged Notable Events",,,,"search `notable` | search (status_group=""New"" OR owner=""unassigned"") | stats count by rule_name | eventstats sum(count) as total"
ES,"DA-ESS-NetworkProtection","Unusual Volume of Network Activity","Detects unusual network traffic that may be indicative of a DoS attack as indicated by a high number of unique sources or a high volume of firewall packets","Network_Traffic",,network,,,,,"Unusual Volume of Network Activity",,,," tstats `summariesonly` dc(All_Traffic.src) as src_count,count as total_count from datamodel=Network_Traffic.All_Traffic | apply app:network_traffic_src_count_30m [|`get_qualitative_upper_threshold(extreme)`] | apply app:network_traffic_count_30m [|`get_qualitative_upper_threshold(extreme)`] | search ""IsOutlier(src_count)""=1 OR ""IsOutlier(total_count)""=1"
ES,"SA-NetworkProtection","Vulnerability Scanner Detected (by events)","Detects a potential vulnerability scanner by detecting devices that have triggered a large number of unique events. Vulnerability scanners generally trigger a high number unique events when scanning a host since each vulnerability check tends to trigger a unique event.","Intrusion_Detection",,network,,,,,"Vulnerability Scanner Detected (by events)",,,," from datamodel:""Intrusion_Detection"".""IDS_Attacks"" | stats values(tag) as ""tag"",dc(signature) as ""count"" by ""src"" | where 'count'>25"
ES,"SA-NetworkProtection","Vulnerability Scanner Detected (by targets)","Detects a potential vulnerability scanner by detecting devices that have triggered events against a large number of unique targets. Vulnerability scanners generally trigger events against a high number of unique hosts when they are scanning a network for vulnerable hosts.","Intrusion_Detection",,network,,,,,"Vulnerability Scanner Detected (by targets)",,,," from datamodel:""Intrusion_Detection"".""IDS_Attacks"" | stats values(tag) as ""tag"",dc(dest) as ""count"" by ""src"" | where 'count'>25"
ES,"SA-ThreatIntelligence","Watchlisted Event Observed","Alerts when an event is discovered including text has been identified as important. This rule triggers whenever an event is discovered with the tag of ""watchlist"".",,,threat,,,,,"Watchlisted Event Observed",,,,"search tag=watchlist NOT sourcetype=stash | eval risk_object=case(isnotnull(user),user,isnotnull(src_user),src_user,isnotnull(dest),dest,isnotnull(src),src,1=1,host) | eval risk_object_type=case(isnotnull(user),""user"",isnotnull(src_user),""user"",isnotnull(dest),""system"",isnotnull(src),""system"",1=1,""system"") | eval risk_score=if(eventtype=""website_watchlist"",50,null()) | eval suppression_value=sourcetype.""|"".risk_object  | `get_event_id` | table _raw,event_id,host,source,sourcetype,src,dest,dvc,src_user,user"
ES,"DA-ESS-IdentityManagement","Web Uploads to Non-corporate Sites by Users","Alerts on high volume web uploads by a user to non-corporate domains.",Web,,identity,,,,,"Web Uploads to Non-corporate Sites by Users",,,," tstats `summariesonly` sum(Web.bytes) as bytes from datamodel=Web.Web where (Web.http_method=""POST"" OR Web.http_method=""PUT"")  NOT (`cim_corporate_web_domain_search(""Web.url"")`) by Web.user, Web.user_bunit | `drop_dm_object_name(""Web"")` | `mltk_apply_upper(""app:web_upload_to_non_corporate_by_user_1h"", ""medium"", ""bytes"")`"
